[
  {
    "rule_id": "jati_tara_26th_nakshatra_property",
    "name": "Jati Tara (26th Nakshatra) — Ancestral Property Day",
    "description": "When transit Moon or Mars reaches the 26th nakshatra from birth Moon (Jati Tara = caste/lineage star), ancestral property matters reach culmination. This is the day for family property events.",
    "source_text": {"work_name": "Muhurta Chintamani", "chapter": "3", "verse": "22", "page": null, "quote": "The 26th nakshatra from Janma Nakshatra is Jati Tara (lineage/caste star). Actions related to family lineage, ancestral property, and hereditary matters find success on this day.", "translation": null},
    "domain": "finance",
    "event_family": "ancestral_property_and_inheritance",
    "event_subtype": ["ancestral_property_day", "lineage_matters", "family_inheritance"],
    "rule_type": "fast_trigger",
    "status": "active",
    "priority": 95,
    "polarity": "supportive",
    "timing_band": "exact",
    "conditions": {"all_of": ["Transit Moon or Mars is in the 26th nakshatra from birth Moon nakshatra (Jati Tara)"], "any_of": ["Dasha layer has already opened a property window", "Transit layer has narrowed the window", "Multiple property indicators are active simultaneously"], "none_of": []},
    "signals": {"dasha": [], "transit": ["Moon_26th_nak", "Mars_26th_nak"], "houses": [], "planets": ["Moon", "Mars"], "nakshatra": ["26th_from_birth"], "d9": [], "sensitive_points": []},
    "interpretation": {"meaning": "Jati Tara (26th nakshatra) is the lineage star. When fast planets (Moon/Mars) transit this point, ancestral property matters culminate — registration, transfer, inheritance receipt, or dispute resolution happen on this exact day.", "mode": "smooth_inheritance", "quality": "supportive", "asset_type": "land", "confidence": 0.88},
    "window": {"broad_window_days": 2, "exact_window_days": 1, "confidence_decay_days": 1},
    "weights": {"dasha_weight": 0.0, "transit_weight": 0.0, "fast_trigger_weight": 0.95, "classical_weight": 0.0},
    "outputs": {"symbolic_label": "jati_tara_ancestral_property_day", "likelihood_band": "high", "timing_band": "exact", "recommended_action": "execute_property_registration_today"},
    "metadata": {"notes": "Jati = lineage/caste. The 26th nak triggers ancestral events. Best day for property registration or inheritance claims."}
  },
  {
    "rule_id": "moon_right_hand_25_27_property_transfer",
    "name": "Moon Right Hand (25-27th Nakshatra) — Property Transfer Moment",
    "description": "Transit Moon in the 25th-27th nakshatra zone from birth Moon (right hand region in Tara chakra) creates the exact moment for property transfer, signing, and material exchange.",
    "source_text": {"work_name": "Muhurta Chintamani", "chapter": "3", "verse": "18-20", "page": null, "quote": "The 25th to 27th nakshatras from Janma form the Dakshina Hasta (right hand). These govern material exchange, transfer of property, and completion of asset transactions.", "translation": null},
    "domain": "finance",
    "event_family": "ancestral_property_and_inheritance",
    "event_subtype": ["property_transfer", "signing_day", "material_exchange"],
    "rule_type": "fast_trigger",
    "status": "active",
    "priority": 90,
    "polarity": "supportive",
    "timing_band": "exact",
    "conditions": {"all_of": ["Transit Moon is in 25th, 26th, or 27th nakshatra from birth Moon"], "any_of": ["Property dasha window is already open", "Transit activation is already confirmed", "Moon is in waxing phase (Shukla Paksha)"], "none_of": []},
    "signals": {"dasha": [], "transit": ["Moon_25th_nak", "Moon_26th_nak", "Moon_27th_nak"], "houses": [], "planets": ["Moon"], "nakshatra": ["25th_from_birth", "26th_from_birth", "27th_from_birth"], "d9": [], "sensitive_points": []},
    "interpretation": {"meaning": "The right hand zone (25-27th nak) governs material exchange and giving/receiving. Transit Moon here creates the exact moment for property deed signing, transfer completion, or inheritance receipt.", "mode": "smooth_inheritance", "quality": "supportive", "asset_type": "land", "confidence": 0.85},
    "window": {"broad_window_days": 3, "exact_window_days": 1, "confidence_decay_days": 1},
    "weights": {"dasha_weight": 0.0, "transit_weight": 0.0, "fast_trigger_weight": 0.90, "classical_weight": 0.0},
    "outputs": {"symbolic_label": "moon_right_hand_property_transfer_day", "likelihood_band": "high", "timing_band": "exact", "recommended_action": "sign_property_documents_today"},
    "metadata": {"notes": "Dakshina Hasta = right hand = giving/receiving. Exact timing for property handover."}
  },
  {
    "rule_id": "moon_two_eyes_9_10_visibility_assets",
    "name": "Moon Two Eyes (9-10th Nakshatra) — Asset Visibility Day",
    "description": "Transit Moon in the 9th-10th nakshatra from birth Moon (Netra/eyes zone) brings visibility to hidden assets, reveals property opportunities, and makes inheritance matters clear.",
    "source_text": {"work_name": "Muhurta Chintamani", "chapter": "3", "verse": "10-12", "page": null, "quote": "The 9th and 10th nakshatras from Janma are Netra Tara (eye stars). They bring clear vision regarding material matters, reveal hidden assets, and illuminate property opportunities.", "translation": null},
    "domain": "finance",
    "event_family": "ancestral_property_and_inheritance",
    "event_subtype": ["hidden_asset_reveal", "property_opportunity", "clear_vision"],
    "rule_type": "fast_trigger",
    "status": "active",
    "priority": 85,
    "polarity": "supportive",
    "timing_band": "exact",
    "conditions": {"all_of": ["Transit Moon is in 9th or 10th nakshatra from birth Moon"], "any_of": ["8th house inheritance matters are active", "Property search is ongoing", "Hidden wealth indicators present in dasha"], "none_of": []},
    "signals": {"dasha": [], "transit": ["Moon_9th_nak", "Moon_10th_nak"], "houses": [], "planets": ["Moon"], "nakshatra": ["9th_from_birth", "10th_from_birth"], "d9": [], "sensitive_points": []},
    "interpretation": {"meaning": "Netra Tara (eye stars, 9-10th nak) brings clarity and visibility. Hidden property, unknown inheritance, or overlooked assets become visible. Good day for property investigation and valuation.", "mode": "sudden_gain", "quality": "supportive", "asset_type": "liquid_wealth", "confidence": 0.82},
    "window": {"broad_window_days": 2, "exact_window_days": 1, "confidence_decay_days": 1},
    "weights": {"dasha_weight": 0.0, "transit_weight": 0.0, "fast_trigger_weight": 0.85, "classical_weight": 0.0},
    "outputs": {"symbolic_label": "moon_eyes_asset_visibility_day", "likelihood_band": "moderate", "timing_band": "exact", "recommended_action": "investigate_property_opportunities"},
    "metadata": {"notes": "Netra = eyes. Reveals hidden assets. Good for property valuation and discovery of inheritance."}
  },
  {
    "rule_id": "mars_head_16_17_land_action_day",
    "name": "Mars Head (16-17th Nakshatra) — Land Action Day",
    "description": "Transit Mars in the 16th-17th nakshatra from birth Moon (Shiras/head zone) creates the day for decisive land action — purchase, registration, boundary marking, or construction start.",
    "source_text": {"work_name": "Muhurta Chintamani", "chapter": "3", "verse": "14-15", "page": null, "quote": "The 16th and 17th nakshatras from Janma are Shiras Tara (head stars). Mars transiting here governs decisive action regarding land, boundaries, and physical property.", "translation": null},
    "domain": "finance",
    "event_family": "ancestral_property_and_inheritance",
    "event_subtype": ["land_action", "construction_start", "boundary_marking"],
    "rule_type": "fast_trigger",
    "status": "active",
    "priority": 88,
    "polarity": "supportive",
    "timing_band": "exact",
    "conditions": {"all_of": ["Transit Mars is in 16th or 17th nakshatra from birth Moon"], "any_of": ["Mars dasha or antardasha is active", "4th house property window is open", "Land purchase or construction is planned"], "none_of": []},
    "signals": {"dasha": [], "transit": ["Mars_16th_nak", "Mars_17th_nak"], "houses": [], "planets": ["Mars"], "nakshatra": ["16th_from_birth", "17th_from_birth"], "d9": [], "sensitive_points": []},
    "interpretation": {"meaning": "Mars in the head zone (16-17th nak) creates the day for decisive land action. Physical property matters — buying land, starting construction, marking boundaries, or taking possession — find success here.", "mode": "sudden_gain", "quality": "supportive", "asset_type": "land", "confidence": 0.84},
    "window": {"broad_window_days": 3, "exact_window_days": 1, "confidence_decay_days": 1},
    "weights": {"dasha_weight": 0.0, "transit_weight": 0.0, "fast_trigger_weight": 0.88, "classical_weight": 0.0},
    "outputs": {"symbolic_label": "mars_head_land_action_day", "likelihood_band": "high", "timing_band": "exact", "recommended_action": "take_physical_property_action_today"},
    "metadata": {"notes": "Mars = land karaka. Head zone = decisive action. The day for physical property transactions."}
  }
]
